{
  "name": "allProps",
  "signature": "function allProps(obj: any, opt: string = 'tvp', depth: number = 6): GenObj | [] | string | boolean",
  "description": {
    "brief": "Inspects an object to identify its properties, potentially including their values, types, or both.",
    "detailed": "This function deeply inspects a given object and retrieves as many properties as possible. It can also include property values, types, or parsed details depending on the specified options through the `opt` parameter. The `opt` parameter accepts 'v' for values, 't' for types, 'p' for parsed readable values, and 'f' to avoid filtering uninteresting properties. If none of 't', 'v', or 'p' is specified, it returns an array of property names. If the depth exceeds the specified limit, it stops the recursive inspection."
  },
  "params": [
    {
      "name": "obj",
      "type": [
        "any"
      ],
      "description": "The object to be inspected for its properties. The function will handle both simple and complex objects.",
      "optional": false
    },
    {
      "name": "opt",
      "type": [
        "string"
      ],
      "defaultValue": "'tvp'",
      "description": "A string containing one or more of the following characters: 'v', 't', 'p', 'f'. 'v' returns raw values, 't' returns types, 'p' returns parsed values, and 'f' includes full property details without filtering. If none of these is specified, just an array of property keys will be returned.",
      "optional": true
    },
    {
      "name": "depth",
      "type": [
        "number"
      ],
      "defaultValue": 6,
      "description": "Defines how deep the recursive search for properties should occur. This prevents infinite recursion in deeply nested structures.",
      "optional": true
    }
  ],
  "tags": [
    "object-analysis",
    "introspection",
    "property-inspection"
  ],
  "relatedFunctions": [
    {
      "name": "getProps",
      "description": "Used for retrieving the own and inherited properties of an object."
    },
    {
      "name": "filterProps",
      "description": "Filters out uninteresting properties from the list of an object's properties."
    },
    {
      "name": "uniqueVals",
      "description": "Ensures uniqueness in an array, which is used when collecting properties."
    }
  ],
  "exampleUsages": [
    {
      "description": "Inspecting a simple object for its properties and their types.",
      "code": [
        "const exampleObj = { a: 1, b: 'two', c: [3, 4] };",
        "const propsWithType = allProps(exampleObj, 't');",
        "console.log(propsWithType);"
      ]
    },
    {
      "description": "Retrieving all unfiltered properties and their values from a nested object.",
      "code": [
        "const complexObj = { x: { y: { z: 5 } }, arr: [1, 2, 3] };",
        "const fullDetails = allProps(complexObj, 'vf', 3);",
        "console.log(fullDetails);"
      ]
    }
  ],
  "sourceCode": "export function allProps(obj: any, opt: string = 'tvp', depth: number = 6): GenObj | [] | string | boolean { ... }",
  "isAsync": false,
  "parameterInterdependencies": "The `opt` parameter determines the behavior of what details are returned for the properties of the object, such as just the keys, key-value pairs, or more detailed property information.",
  "errors": [
    {
      "type": "Exception",
      "description": "If the input object is invalid or causes an unexpected error during the property inspection, an exception is caught and a descriptive error message is returned."
    }
  ],
  "return": {
    "types": [
      "GenObj",
      "Array",
      "string",
      "boolean"
    ],
    "description": "Returns a generalized object structure for properties if key details are requested (via options), a flat array if just keys were requested, a string if the depth limit is exceeded, or boolean if the attempted inspection fails due to input object type checks."
  },
  "dependencies": [
    {
      "name": "isObject",
      "type": "function"
    },
    {
      "name": "typeOf",
      "type": "function"
    },
    {
      "name": "getProps",
      "type": "function"
    },
    {
      "name": "filterProps",
      "type": "function"
    },
    {
      "name": "uniqueVals",
      "type": "function"
    },
    {
      "name": "isBuiltIn",
      "type": "function"
    }
  ],
  "notes": [
    "Depth management is crucial to avoid stack overflow errors in deep or recursive objects.",
    "Filtering reduces complex objects to more interesting or relevant properties."
  ],
  "todos": [
    "Consider improving error messages for clarity on failures.",
    "Add support for new data types or recognize more built-in JS classes."
  ],
  "edgeCases": [
    {
      "description": "Handling circular references within objects.",
      "example": [
        "const a = {};",
        "a.b = a;",
        "const result = allProps(a);"
      ],
      "consequence": "If not handled correctly, this would lead to infinite loops and potential stack overflow."
    },
    {
      "description": "Empty or null input objects.",
      "example": [
        "const result1 = allProps(null);",
        "const result2 = allProps({});"
      ],
      "consequence": "Should handle gracefully, potentially returning an empty result or a descriptive type identification."
    }
  ]
}

